{
  "generated_at": "2026-06-16T15:23:47.496569+00:00",
  "commit": "00000000",
  "diagnostic_logd": "diagnostic/build-00000000.logd",
  "diagnostic_logd_error": null,
  "chunked": false,
  "chunk_size_bytes": null,
  "password": "4c7df15ab09fbb066197",
  "decrypt_command": "encryptly unpack diagnostic/build-00000000.logd <outdir> --password 4c7df15ab09fbb066197",
  "total_modules": 1,
  "passed": 0,
  "failed": 1,
  "modules": [
    {
      "name": "frailbox",
      "status": "FAIL",
      "elapsed_seconds": 0.0,
      "artifact": null,
      "output": "Command not found: [Errno 2] No such file or directory: 'make'"
    }
  ],
  "pr_note": "Include this JSON diagnostic report and diagnostic/build-00000000.logd in your PR."
}