{
  "generated_at": "2026-06-20T10:00:00.000000+00:00",
  "commit": "3774a0c821d206132ed2d89bfc820929493a7635",
  "diagnostic_logd": "diagnostic/build-3774a0c8.logd",
  "diagnostic_logd_error": null,
  "chunked": false,
  "chunk_size_bytes": null,
  "password": "a1b2c3d4e5f6a1b2c3d4e5f6",
  "decrypt_command": "encryptly unpack diagnostic/build-3774a0c8.logd <outdir> --password a1b2c3d4e5f6a1b2c3d4e5f6",
  "total_modules": 3,
  "passed": 3,
  "failed": 0,
  "modules": [
    {
      "name": "backend",
      "status": "PASS",
      "elapsed_seconds": 12.5,
      "artifact": "backend/target/release/kickama",
      "output": "Build completed"
    },
    {
      "name": "frontend",
      "status": "PASS",
      "elapsed_seconds": 8.2,
      "artifact": null,
      "output": "Frontend built"
    },
    {
      "name": "market",
      "status": "PASS",
      "elapsed_seconds": 3.1,
      "artifact": "market/bin/market",
      "output": "Market module compiled"
    }
  ],
  "pr_note": "Include this JSON diagnostic report."
}